<?xml version="1.0" encoding="UTF-8"?>
<wallets version="1.0"
  xmlns="http://www.w3schools.com" xmlns:xsi="http://www.w3.org/2001/XMLSchema-instance"
  xsi:schemaLocation="http://www.w3schools.com ./Wallets.xsd">
  
  <wallet name="Bitcoin">
    <url>http://www.bitcoin.com/</url>
    <!-- path to icon -->
    <icon>:images/bitcoin.png</icon>
    <!-- type: server enumeration type: BitsharesClient, other -->
    <server type="other" path="./plugins/bitshares_client.exe" port="80">
      <!-- optional command line arguments  -->
      <!-- <arg>command-line-arg1</arg>  -->
      <!-- <arg>command-line-arg2</arg>  -->
    </server>    
  </wallet>
  <wallet name="BitShares">
    <url>http://127.0.0.1/</url>
    <icon>:images/bitshares.png</icon>
    <server type="BitsharesClient" path="./plugins/bitshares_client.exe" port="9987">
		<arg>--data-dir</arg>
		<arg>$keyhotee_profile/BitSharesXT</arg>
	</server>
  </wallet>
  <wallet name="Litecoin">
    <url>https://litecoin.org/</url>
    <icon>:images/litecoin128.png</icon>
    <server type="other" path="./plugins/bitshares_client.exe" port="443"/>
  </wallet>
</wallets>